[
  {
    "id": "officer_custom_singuack",
    "name": "辛希瓜克",
    "rarityId": "rarity_5",
    "visualGradeId": "grade_5",
    "typeId": "type_class_1",
    "genderId": "gender_m",
    "jobId": "job_job21402003",
    "nationalityId": "nationality_ctn_crb",
    "languages": [
      {
        "languageId": "language_lang240",
        "level": 5
      }
    ],
    "skills": [
      {
        "skillId": "skill_skill501356",
        "kind": "passive",
        "sourceGroup": "sk0",
        "slot": 0,
        "unlockLevel": 1,
        "level": 1
      },
      {
        "skillId": "skill_skill202141",
        "kind": "passive",
        "sourceGroup": "sk0",
        "slot": 1,
        "unlockLevel": 1,
        "level": 1
      },
      {
        "skillId": "skill_skill202041",
        "kind": "passive",
        "sourceGroup": "sk0",
        "slot": 2,
        "unlockLevel": 1,
        "level": 1
      },
      {
        "skillId": "skill_skill203286",
        "kind": "passive",
        "sourceGroup": "sk0",
        "slot": 3,
        "unlockLevel": 1,
        "level": 1
      },
      {
        "skillId": "skill_skill100048",
        "kind": "passive",
        "sourceGroup": "sk0",
        "slot": 4,
        "unlockLevel": 1,
        "level": 1
      },
      {
        "skillId": "skill_skill201981",
        "kind": "passive",
        "sourceGroup": "sk0",
        "slot": 5,
        "unlockLevel": 1,
        "level": 1
      },
      {
        "skillId": "skill_skill202001",
        "kind": "passive",
        "sourceGroup": "sk0",
        "slot": 6,
        "unlockLevel": 1,
        "level": 1
      },
      {
        "skillId": "skill_skill200881",
        "kind": "passive",
        "sourceGroup": "sk0",
        "slot": 7,
        "unlockLevel": 1,
        "level": 1
      },
      {
        "skillId": "skill_skill400089",
        "kind": "active",
        "sourceGroup": "sk2",
        "slot": 0,
        "unlockLevel": 1,
        "level": 1
      },
      {
        "skillId": "skill_skill400861",
        "kind": "active",
        "sourceGroup": "sk2",
        "slot": 1,
        "unlockLevel": 1,
        "level": 1
      },
      {
        "skillId": "skill_skillT0091",
        "kind": "passive",
        "sourceGroup": "sk5",
        "slot": 0,
        "unlockLevel": 1,
        "level": 1
      },
      {
        "skillId": "skill_skillT0176",
        "kind": "passive",
        "sourceGroup": "sk5",
        "slot": 1,
        "unlockLevel": 1,
        "level": 1
      }
    ],
    "recruitment": {
      "cityIds": [],
      "requirementId": null,
      "requiredOfficerIds": [],
      "note": "待補充招募資訊"
    },
    "portraitId": null,
    "displayOrder": 628,
    "sourceRefs": {
      "submissionId": "legacy_singuack"
    },
    "maintenanceNote": "手動新增 — 2026-08-07"
  },
  {
    "id": "officer_custom_piyale",
    "name": "皮雅利·帕夏",
    "rarityId": "rarity_5",
    "visualGradeId": "grade_5",
    "typeId": "type_class_1",
    "genderId": "gender_m",
    "jobId": "job_job21402013",
    "nationalityId": "nationality_ctn_tur",
    "languages": [
      {
        "languageId": "language_lang60",
        "level": 5
      },
      {
        "languageId": "language_lang80",
        "level": 3
      }
    ],
    "skills": [
      {
        "skillId": "skill_skill501046",
        "kind": "passive",
        "sourceGroup": "sk0",
        "slot": 0,
        "unlockLevel": 1,
        "level": 1
      },
      {
        "skillId": "skill_skill202366",
        "kind": "passive",
        "sourceGroup": "sk0",
        "slot": 1,
        "unlockLevel": 1,
        "level": 1
      },
      {
        "skillId": "skill_skill202646",
        "kind": "passive",
        "sourceGroup": "sk0",
        "slot": 2,
        "unlockLevel": 1,
        "level": 1
      },
      {
        "skillId": "skill_skill201041",
        "kind": "passive",
        "sourceGroup": "sk0",
        "slot": 3,
        "unlockLevel": 1,
        "level": 1
      },
      {
        "skillId": "skill_skill201981",
        "kind": "passive",
        "sourceGroup": "sk0",
        "slot": 4,
        "unlockLevel": 1,
        "level": 1
      },
      {
        "skillId": "skill_skill200901",
        "kind": "passive",
        "sourceGroup": "sk0",
        "slot": 5,
        "unlockLevel": 1,
        "level": 1
      },
      {
        "skillId": "skill_skill500826",
        "kind": "passive",
        "sourceGroup": "sk0",
        "slot": 6,
        "unlockLevel": 1,
        "level": 1
      },
      {
        "skillId": "skill_skill100052",
        "kind": "passive",
        "sourceGroup": "sk0",
        "slot": 7,
        "unlockLevel": 1,
        "level": 1
      },
      {
        "skillId": "skill_skill400089",
        "kind": "active",
        "sourceGroup": "sk2",
        "slot": 0,
        "unlockLevel": 1,
        "level": 1
      },
      {
        "skillId": "skill_skill400861",
        "kind": "active",
        "sourceGroup": "sk2",
        "slot": 1,
        "unlockLevel": 1,
        "level": 1
      },
      {
        "skillId": "skill_skillT0091",
        "kind": "passive",
        "sourceGroup": "sk5",
        "slot": 0,
        "unlockLevel": 1,
        "level": 1
      },
      {
        "skillId": "skill_skillT0040",
        "kind": "passive",
        "sourceGroup": "sk5",
        "slot": 1,
        "unlockLevel": 1,
        "level": 1
      },
      {
        "skillId": "skill_wo_offline_adventure_battle_hazard",
        "kind": "passive",
        "sourceGroup": "sk5",
        "slot": 2,
        "unlockLevel": 1,
        "level": 1
      }
    ],
    "recruitment": {
      "cityIds": [],
      "requirementId": null,
      "requiredOfficerIds": [],
      "note": "待補充招募資訊"
    },
    "portraitId": null,
    "displayOrder": 629,
    "sourceRefs": {
      "submissionId": "legacy_piyale"
    },
    "maintenanceNote": "手動新增 — 2026-08-07"
  }
]
